{
  "schema_version": 1,
  "catalogue_version": "0.1.0",
  "source_issue": "PenniLogic/docs#84",
  "placeholders": [],
  "keys": [
    {
      "key": "common.action.cancel",
      "category": "action",
      "copy": "Cancel",
      "status": "provisional",
      "term_refs": [],
      "regulated_ref": null,
      "range": {
        "min": 3,
        "typical": 6,
        "max": 16
      },
      "owner": "content",
      "platforms": [
        "android",
        "web",
        "admin"
      ],
      "neutral_safe_exit": false
    },
    {
      "key": "common.action.close",
      "category": "action",
      "copy": "Close",
      "status": "provisional",
      "term_refs": [],
      "regulated_ref": null,
      "range": {
        "min": 2,
        "typical": 5,
        "max": 15
      },
      "owner": "content",
      "platforms": [
        "android",
        "web",
        "admin"
      ],
      "neutral_safe_exit": false
    },
    {
      "key": "common.action.continue",
      "category": "action",
      "copy": "Continue",
      "status": "provisional",
      "term_refs": [],
      "regulated_ref": null,
      "range": {
        "min": 4,
        "typical": 8,
        "max": 18
      },
      "owner": "content",
      "platforms": [
        "android",
        "web",
        "admin"
      ],
      "neutral_safe_exit": false
    },
    {
      "key": "common.label.aggregate",
      "category": "label",
      "copy": "Aggregate total",
      "status": "provisional",
      "term_refs": [
        "term.aggregate"
      ],
      "regulated_ref": null,
      "range": {
        "min": 7,
        "typical": 15,
        "max": 30
      },
      "owner": "content",
      "platforms": [
        "android",
        "web",
        "admin"
      ],
      "neutral_safe_exit": false
    },
    {
      "key": "common.label.available",
      "category": "label",
      "copy": "Available",
      "status": "provisional",
      "term_refs": [
        "term.available"
      ],
      "regulated_ref": null,
      "range": {
        "min": 4,
        "typical": 9,
        "max": 19
      },
      "owner": "content",
      "platforms": [
        "android",
        "web",
        "admin"
      ],
      "neutral_safe_exit": false
    },
    {
      "key": "common.label.payoff_date",
      "category": "label",
      "copy": "Payoff date",
      "status": "provisional",
      "term_refs": [
        "term.payoff"
      ],
      "regulated_ref": null,
      "range": {
        "min": 5,
        "typical": 11,
        "max": 22
      },
      "owner": "content",
      "platforms": [
        "android",
        "web",
        "admin"
      ],
      "neutral_safe_exit": false
    },
    {
      "key": "common.label.pending",
      "category": "label",
      "copy": "Pending",
      "status": "provisional",
      "term_refs": [
        "term.pending"
      ],
      "regulated_ref": null,
      "range": {
        "min": 3,
        "typical": 7,
        "max": 17
      },
      "owner": "content",
      "platforms": [
        "android",
        "web",
        "admin"
      ],
      "neutral_safe_exit": false
    },
    {
      "key": "common.label.projected",
      "category": "label",
      "copy": "Projected",
      "status": "provisional",
      "term_refs": [
        "term.projected"
      ],
      "regulated_ref": null,
      "range": {
        "min": 4,
        "typical": 9,
        "max": 19
      },
      "owner": "content",
      "platforms": [
        "android",
        "web",
        "admin"
      ],
      "neutral_safe_exit": false
    },
    {
      "key": "common.label.reversed",
      "category": "label",
      "copy": "Reversed",
      "status": "provisional",
      "term_refs": [
        "term.reversed"
      ],
      "regulated_ref": null,
      "range": {
        "min": 4,
        "typical": 8,
        "max": 18
      },
      "owner": "content",
      "platforms": [
        "android",
        "web",
        "admin"
      ],
      "neutral_safe_exit": false
    },
    {
      "key": "common.label.revoked",
      "category": "label",
      "copy": "Access revoked",
      "status": "provisional",
      "term_refs": [
        "term.revoked"
      ],
      "regulated_ref": null,
      "range": {
        "min": 7,
        "typical": 14,
        "max": 28
      },
      "owner": "content",
      "platforms": [
        "android",
        "web",
        "admin"
      ],
      "neutral_safe_exit": false
    },
    {
      "key": "common.safe_exit.denial",
      "category": "denial",
      "copy": "This isn't available here",
      "status": "provisional",
      "term_refs": [],
      "regulated_ref": null,
      "range": {
        "min": 12,
        "typical": 25,
        "max": 50
      },
      "owner": "content",
      "platforms": [
        "android",
        "web",
        "admin"
      ],
      "neutral_safe_exit": true
    },
    {
      "key": "common.safe_exit.notification",
      "category": "notification",
      "copy": "You have an update",
      "status": "provisional",
      "term_refs": [],
      "regulated_ref": null,
      "range": {
        "min": 9,
        "typical": 18,
        "max": 36
      },
      "owner": "content",
      "platforms": [
        "android",
        "web",
        "admin"
      ],
      "neutral_safe_exit": true
    },
    {
      "key": "pattern.destructive.consequence",
      "category": "destructive",
      "copy": "Their history is deleted with them and can't be restored",
      "status": "provisional",
      "term_refs": [],
      "regulated_ref": null,
      "range": {
        "min": 24,
        "typical": 49,
        "max": 98
      },
      "owner": "content",
      "platforms": [
        "android",
        "web",
        "admin"
      ],
      "neutral_safe_exit": false
    },
    {
      "key": "pattern.destructive.next_action",
      "category": "destructive",
      "copy": "Delete {item}",
      "status": "provisional",
      "term_refs": [],
      "regulated_ref": null,
      "range": {
        "min": 6,
        "typical": 13,
        "max": 26
      },
      "owner": "content",
      "platforms": [
        "android",
        "web",
        "admin"
      ],
      "neutral_safe_exit": false
    },
    {
      "key": "pattern.destructive.safe_remainder",
      "category": "destructive",
      "copy": "Your other records stay as they are",
      "status": "provisional",
      "term_refs": [],
      "regulated_ref": null,
      "range": {
        "min": 17,
        "typical": 35,
        "max": 70
      },
      "owner": "content",
      "platforms": [
        "android",
        "web",
        "admin"
      ],
      "neutral_safe_exit": false
    },
    {
      "key": "pattern.destructive.source",
      "category": "destructive",
      "copy": "Selected: {item}",
      "status": "provisional",
      "term_refs": [],
      "regulated_ref": null,
      "range": {
        "min": 8,
        "typical": 16,
        "max": 32
      },
      "owner": "content",
      "platforms": [
        "android",
        "web",
        "admin"
      ],
      "neutral_safe_exit": false
    },
    {
      "key": "pattern.destructive.status",
      "category": "destructive",
      "copy": "{item} will be deleted",
      "status": "provisional",
      "term_refs": [],
      "regulated_ref": null,
      "range": {
        "min": 11,
        "typical": 22,
        "max": 44
      },
      "owner": "content",
      "platforms": [
        "android",
        "web",
        "admin"
      ],
      "neutral_safe_exit": false
    },
    {
      "key": "pattern.recovery.consequence",
      "category": "recovery",
      "copy": "Figures now match your last saved copy",
      "status": "provisional",
      "term_refs": [],
      "regulated_ref": null,
      "range": {
        "min": 19,
        "typical": 38,
        "max": 76
      },
      "owner": "content",
      "platforms": [
        "android",
        "web",
        "admin"
      ],
      "neutral_safe_exit": false
    },
    {
      "key": "pattern.recovery.next_action",
      "category": "recovery",
      "copy": "Review {item}",
      "status": "provisional",
      "term_refs": [],
      "regulated_ref": null,
      "range": {
        "min": 6,
        "typical": 13,
        "max": 26
      },
      "owner": "content",
      "platforms": [
        "android",
        "web",
        "admin"
      ],
      "neutral_safe_exit": false
    },
    {
      "key": "pattern.recovery.safe_remainder",
      "category": "recovery",
      "copy": "Changes made elsewhere stay as they are",
      "status": "provisional",
      "term_refs": [],
      "regulated_ref": null,
      "range": {
        "min": 19,
        "typical": 39,
        "max": 78
      },
      "owner": "content",
      "platforms": [
        "android",
        "web",
        "admin"
      ],
      "neutral_safe_exit": false
    },
    {
      "key": "pattern.recovery.source",
      "category": "recovery",
      "copy": "Restored from your last saved copy",
      "status": "provisional",
      "term_refs": [],
      "regulated_ref": null,
      "range": {
        "min": 17,
        "typical": 34,
        "max": 68
      },
      "owner": "content",
      "platforms": [
        "android",
        "web",
        "admin"
      ],
      "neutral_safe_exit": false
    },
    {
      "key": "pattern.recovery.status",
      "category": "recovery",
      "copy": "{item} are back",
      "status": "provisional",
      "term_refs": [],
      "regulated_ref": null,
      "range": {
        "min": 7,
        "typical": 14,
        "max": 28
      },
      "owner": "content",
      "platforms": [
        "android",
        "web",
        "admin"
      ],
      "neutral_safe_exit": false
    },
    {
      "key": "pattern.success.consequence",
      "category": "success",
      "copy": "Totals now include this change",
      "status": "provisional",
      "term_refs": [],
      "regulated_ref": null,
      "range": {